id,created_on,operation,property_type,lat,lon,price_aprox_usd,surface_total_in_m2,surface_covered_in_m2,rooms,expenses,description,title,lat,lon,housenumber,street,state,city,bathrooms
bbf5c4c6c782c1c3d4aec1419397f4c065f0ab06,2017-09-22,rent,Departamento,-34.6120616,-58.3620321,7000.0,444,345.0,4,52000.0,"- Increíble departamento en Dúplex en 2 plantas con Terraza propia y parrilla. PB: Palier privado, toilette, gran living comedor con vista a todas las direcciones y balcón. Cocina comedor y dependencia de servicio. Posibilidad de habitación en suite (4to dormitorio). En PA: 3 habitaciones en suite, principal con balcón, vista al río y doble baño con hidromasajes. Impactante terraza con deck baño y parrilla. Doble circulación.  ABL 13000  Nota: La informacion grafica y escrita contenida en el presente aviso es meramente a titulo estimativo y no forma parte de ningún tipo de documentación contractual. Las medidas y superficies definitivas surgirán del titulo de propiedad del inmueble referido. Asimismo los importes de tasas, servicios y expensas indicados están sujetos a verificación. El valor del inmueble indicado en el presente puede ser modificado sin previo aviso.",Puerto Madero,-34.6016,-58.3874,1455,Tucuman,Ciudad de Buenos Aires,Ciudad Autónoma de Buenos Aires,2
4e9c9aebe3c6c6970d482aa46319ff117468de1e,2017-11-02,rent,Casa,-38.0173022,-57.5317828,14000.0,800,450.0,6,,"Disponible desde el 20 de Diciembre al 31 de eneroChalet de estilo. 4 dormitorios, 3 en suit. Dependencia de servicio. Amplio living comedor. Estar parrilla comedor diario. Garage para 3 autos. Parque. Piscina climatizada. Parrila exterior. Todo en prefecto estado!",Alquiler chalet por temporada,-34.604996,-58.379425,300,Suipacha,Ciudad de Buenos Aires,Ciudad Autónoma de Buenos Aires,2
87f9301bd9a1c4b4211c6b27fe46811fd7bd6fbb,2017-07-19,rent,Casa,-34.4839068,-58.4842523,14000.0,1400,1400.0,9,,"Imponente residencia de 1400 m2, inigualable vista al río desde la mayoría de sus amplios y luminosos ambientes . Excelente diseño y calidad constructiva ( pizarra francesa, mármoles italianos) .Absoluta privacidad visual.De los 2400m2 de tierra, 1000 m2 son planos en el tope de la barranca. Estilo Californiano al frente ( madera y lucarnas) y Miamense atrás ( grandes ventanales que maximizan visuales al río ,de reforzado aluminio. Pisos de mármol italiano en living, terraza y family room que permite unir los tres ambientes en caso de gran recepción ; escalera de mármol a subsuelo.  Paredes dobles c/cámara aire (Stiglitz) ;techo pizarra francesa ; vidrios dobles ; calefacción por piso radiante ; aire acondicionado central con graduación en cada ambiente (fan-coil), excepto en cuarta planta y subsuelo; tres chimeneas ; siete hidromasajes (dos exteriores) ; sala de máquinas ; pileta en tercer piso de estructura separada,  con jacuzzi, cascada y nado contra-corriente. Suite principal de 130 m2 con banio de mármoles italianos, jacuzzi doble y ducha ,ambos con vista al río , dos vestidores . Garage p/dos autos , cochera p/ cuatro autos y calle interna p/12 autos. Parque  barranca diseñado por Thais. Estanque con fuente.  Gran sistema de seguridad,posibilidad de hacer un gran panic-room. Vidrios antibalas en Play-room y living . CONSULTAR POR VENTA.",Casa - Mart.-Libert./Rio,-34.6007,-58.4362,386,"Alvarez, Julian",Ciudad de Buenos Aires,Ciudad Autónoma de Buenos Aires,2
0142adcca8abea7e563d6f875349f6d17a21f778,2017-07-19,rent,Departamento,-34.5714101,-58.4620948,4700.0,354,308.0,7,25000.0,"EXCELENTE PISO DE CATEGORÍA EN EDIFICIO MARIO ROBERTO ALVAREZ - PARQUE - PISCINA - QUINCHO - PARRILLA - CALIDAD DE MATERIALES.EDIFICIO3 pisos  - 1 departamento por piso - Gran jardín - Piscina - Solarium - Quincho - SUM. PISOPalier privado - Gran recepción con piso de mármol Botticino con hogar, salida a balcón aterrazado con vista al jardín - Boiserie en roble masizo - Escritorio - Amplia cocina con comedor diario - Dependencia de servicio con baño completo con ducha - Toilette de recepción - 3 dormitorios en suite, principal con vestidor y baño revestido en mármol rosado italiano, tricompartimentado. Pisos de roble de eslavonia - Levanta persianas eléctricos en todos los ambientes - Dos cocheras cubiertas fijas y dos descubiertas - Baulera.DETALLESCalefacción por losa radiante central - Aire acondicionado - Calidad de materiales. Superficie cubierta: 308m2.Superficie total: 354m2.Expensas: $25.000ABL: $6.000Ubicación: Conde 1700 (Esquina Virrey del Pino) Belgrano R, excelente ubicación.Visitar solo acompañado con personal de la firmaSolicitar visita al  ó al ",EXCELENTE PISO DE CATEGORÍA EN EDIFICIO MARIO ROBERTO ALVAREZ - PARQUE - PISCINA - QUINCHO - PARRILLA - CALIDAD DE MATERIALES.,-34.6164,-58.3673,760,Azopardo,Ciudad de Buenos Aires,Ciudad Autónoma de Buenos Aires,2
bf7c9b415c1b547cd6bbb5b431940509c6c2fcdf,2017-11-17,rent,Departamento,-34.5530228,-58.4391058,6500.0,225,200.0,4,,"Departamento  de 4 ambientes, con salida a balcón terraza y vista panorámica al Río y a la Ciudad de Buenos Aires. Con palier privado,  living-comedor, toilette, cocina y dependencia de servicio con baño. Con 3 dormitorios (Ppal. en suite c/vestidor) y baño completo. Con baulera y 2 cocheras, fijas y cubiertas. FORUM ALCORTA, torre de cristal y hormigón que se eleva en una manzana de 13.000 m2, con amenities que aseguran el máximo disfrute y bienestar: SUM, sector parrilla, área de juegos para niños, piscina cubierta y descubierta con zonas para niños, parque central, cancha de tenis cubierta y descubierta, fitness center con vestuarios y saunas, bicicleteros y laundry. Internet inalámbrico en áreas comunes. Seguridad perimetral y vigilancia central (24 hs). Torre ubicada a 1 cuadra de Av. Juramento, a 2 cuadras de Av. Pres. Figueroa Alcorta y a 7 cuadras de Av. Del Libertador en exclusiva zona de Belgrano Chico.David Cipolla PropiedadesBelgrano  I La Imprenta  I Barrancas  .  Matrículas 4052-CUCICBA I 6065-CMCPSI","Ramsay al 2000, entre Echeverria y Dragones. Departamento de 4 ambientes. ",-34.5878,-58.4939,4124,"Artigas, Jose Gervasio, Gral.",Ciudad de Buenos Aires,Ciudad Autónoma de Buenos Aires,2
9adfe590cab9f3532bef6995378c56bf66cc1efd,2017-10-13,rent,Departamento,-34.5890337,-58.3871146,6500.0,400,400.0,8,," Se ingresa por palier privado a elegante hall de entrada, hacia una gran recepción dividida en tres grandes ambientes, Living, comedor (con acceso a cocina y living) y  escritorio o HOME ROOM. Toilette. Hall de distribución en el corazón del departamento donde a mano derecha nos lleva a un gran comedor diario con vista a jardín/patio, bar con cava de vinos, con equipos de música ambiental para toda la recepción, luego Impactante cocina, con gran isla, con vista a patio/ jardin muy moderna totalmente equipada (hornos, 2 heladeras, lavaplatos, freidora,etc), lavadero con lavarropa y secadora, dos dormitorios de servicio y su baño. mucho placard.Totalmente reciclado con materiales muy buenos.Del hall central a mano izquierda, están las 4 habitaciones. 2 en suite (baños impecables y grandes) una con vestidor y otros dos dormitorios que  comparten un baño.  Mucho placard. BauleraSeguridad 24 hs, cochera. Precio paquete. Las medidas, expensas y superficies consignados en la presente son aproximados y que no resultan vinculantes, los datos definitivos son los que surgen del titulo de propiedad.",Elegante departamento 4 dormitorios en Recoleta con o sin muebles,-34.713942,-58.393095,5101,Avenida Hipólito Yrigoyen,Buenos Aires,Remedios de Escalada,2
7471bad66ff3ec441f4edf9fbea605a7ecdb2561,2017-10-29,rent,Departamento,-34.5827647,-58.3989651,6500.0,313,288.0,7,,"Departamento ultima generación.Detalles de gran categoría y calidad.Palier Privado, Hall de entrada2 grandes Livings y Comedor y Escritorio, 5 ventanales a balcón corrido.Toilette de recepción. 2 Dormitorios en Suite principal con Vestidor.2 Dormitorios con 1 Baño completo compartido.Gran Cocina con Isla super MODERNA !Lavadero independiente, 2 Dependencias de servicio con su baño.1 Cochera fija, Baulera, Vigilancia 24hsDetallesBaño principal en mármol Arabescato italianoDormitorio principal con doble aventanamiento en modo de anular los ruidos del traficoGriferias FV modelo DominiqueSanitarios FerrumAmplios vestidoresInstalación sanitaria a nuevo en todo el departamentoInstalación eléctrica a nuevo en todo el departamentoSistema de WIFI de amplio rango y amplo manejo de usuarios marca UBIQUITYCentral telefonica con posibilidad de hablar con portería desde cada internoCableado de red nivel 5 en todas las habitacionesSistema de Aire Acondicionado DAIKIN frío calor por conductos en cada habitación Cava de vinos de gran capacidadHorno SMEG italiano de 90 cmAnafe de 90 cm marca FRANKEPileta de cocina marca FRANKEMesadas de cocina y lavadero en CARRARA VENATINO Iluminación de cielorrasos LED marca CONCEPTO Y LUZHeladera Side by Side marca MIDEALavarropas 9kg SAMSUNGSecarropas 9 kg ARISTON",Lindisimo departamento a ESTRENAR con doble frente a Plaza !,-34.6037,-58.3785,830,Corrientes Av.,Ciudad de Buenos Aires,Ciudad Autónoma de Buenos Aires,2
29c5dbfea798678949ac51b77d9c2ca8e48b72f1,2017-07-19,rent,Local,-34.6067309778,-58.3708016206,6500.0,800,800.0,2,64000.0,"Local Comercial en Esquina, últimos inquilinos, BBVA y anterior Casa Matriz del Banco Bisel.Superficies  PB: 400 m2, SS: 400 m2 Otras superficies en el edificio, Piso 2: 460 m2 comunicado con el Local por ascensor privado.Edificio de oficinas con amplios pisos en planta libre y muy luminosos por estar en esquina.Acceso a cocheras por Bartolomé Mitre y grupo electrógeno para espacio comunes. 2 ascensores automáticos. Seguridad . El ingreso es por la Peatonal 25 de MayoLa oficina tiene artefactos de iluminación y aire acondicionado central frio calor.Expensas, ABL y AySA $64.000 mensualesTransportes CercanosColectivos:	4, 6, 7, 8, 20, 22, 24, 26, 28, 29, 33, 50, 56, 61, 62, 64, 74, 86, 91, 93, 105, 109, 111, 126, 129, 130, 140, 143, 146, 152, 159, 180, 195Subtes (Metro):BOLIVAR (Línea E), CATEDRAL (Línea D), LEANDRO N. ALEM (Línea B), PERÚ (Línea A), PLAZA DE MAYO (Línea A)",Oficina - Microcentro,-34.6033,-58.3776,767,Corrientes Av.,Ciudad de Buenos Aires,Ciudad Autónoma de Buenos Aires,2
35bb029f16717c269264b1f2f7c59dd48c871e64,2017-09-22,rent,Departamento,-34.6134686,-58.3624207,6500.0,252,169.0,3,,"Tríplex ubicado en LA PORTEÑA, edificio frente al Hotel Faena. Este departamento cuenta con un amplio living comedor, cocina totalmente equipada en la primer planta. En la segunda planta dos dormitorios grandes en suite y una terraza privada privilegiada en el último piso del edificio.Está totalmente equipado con muebles diseñados por Phillipe Starck y tiene una muy linda vista y abierta al parque. Usualmente es utilizado por el Hotel como suite especial. 1 Cochera.Gym y pileta de La Porteña Residences, Conserjería 24hs, Seguridad 24hs. El alquiler INCLUYE EXPENSAS. El inquilino deberá abonar mensualmente el ABL de $ 3500. Nota: La informacion grafica y escrita contenida en el presente aviso es meramente a titulo estimativo y no forma parte de ningún tipo de documentación contractual. Las medidas y superficies definitivas surgirán del titulo de propiedad del inmueble referido. Asimismo los importes de tasas, servicios y expensas indicados están sujetos a verificación. El valor del inmueble indicado en el presente puede ser modificado sin previo aviso. ",Inmejorable Triplex en La Porteña Faena,-34.6033,-58.3776,767,Corrientes Av.,Ciudad de Buenos Aires,Ciudad Autónoma de Buenos Aires,2
3d71d82de4b29bfa3dc2a8ba172fcb5dac99965c,2017-10-10,rent,Casa,-37.0763328984,-56.8322653346,6500.0,1014,280.0,5,,"Memory: Minimalista de 3 dorm. en suite, dependencias, Galería c/ parrilla y Pileta climatizada.Memory: Minimalista de 3 dorm. en suite, dependencias, Galería c/ parrilla y Pileta climatizada. Distribución: PB: Living comedor, toilette, cocina comedor c/ parrilla interna. dependencias de servicio c/ baño completo y lavadero. Galería c/ parrilla. Pileta climatizada. Dos dormitorios en suite. PA: Dormitorio principal en suite c/ vestidor. Terrazas solariúm. SUM. Características Edilicias: Paredes dobles, techo losa, aberturas en aluminio c/ doble vidrio, pisos de Porcellanato, calefacción por radiadores, riego por aspersión.","Alquiler x temporada: Minimalista de 3 dorm. en suite, dependencias, Galería c/ parrilla y Pileta climatizada. Zona Penelope",-34.5936,-58.4275,1286,Araoz,Ciudad de Buenos Aires,Ciudad Autónoma de Buenos Aires,2
8cd32d3a386f1b5a94b7110529664c54f6df820a,2017-07-14,rent,Casa,-34.40953,-58.614391,6500.0,1000,1000.0,5,, Casa sobre el Rio con amarra!6500 usd mensualesAmuebladaLujosa ," Albanueva Alquiler, Casa Hermosa, con o sin muebles",-34.590176,-58.432189,1399,Serrano,Ciudad de Buenos Aires,Ciudad Autónoma de Buenos Aires,2
0f4bf6f53e5b0f686a92394be26efe17f4b50a05,2017-07-14,rent,Casa,-34.40953,-58.614391,6500.0,1450,450.0,5,, Casa sobre el Rio con amarra!6500 usd mensualesAmuebladaLujosa ," Albanueva Alquiler por temporada, Casa Hermosa, Amoblada Nueva",-26.7951979,-60.4451688,101,Azcuénaga,Chaco,Presidencia Roque Sáenz Peña,2
5e4e7b7cb7e4c2a79185da2463ee7660a2ebfada,2017-07-19,rent,Departamento,-31.4147441,-64.1883898,13000.0,130,120.0,8,1350.0,"Gran departamento de 3 Dormitorios ubicado en un piso bajo, orientación al frente - Ingreso por ascensor directo - Gran estar comedor, 3 dormitorio y una gran sala de estudio mas depositoEl departamento original se modifico para ser adaptado como un gran estudio jurido - Ingreso al la recepción por escalera y ascensor - Gran sala de reuniones con ventanales al frente - 3 oficinas con bibliotecas empotradas - Gran baño zonificado - Gran espacio archero - Cocina separada - Gran balcón cerrado cerrado como deposito - Departamento con ventilación cruzada - Piso completo",Departamento - Centro,-37.114111,-56.862652,560,Avenida Arquitecto Jorge Bunge,Buenos Aires,Pinamar,2
25180b33941623a936183ee3f2de3b4d57cd6f6a,2017-09-18,rent,Departamento,-34.613587,-58.361843,2099.0,85,85.0,2,,"Corredor Responsable: Alejandro Botta - CUCICBA 5922Contacto: María Rosa Zuazo - MLS ID # 420391014-95MARTILLERO: ALEJANDRO BOTTA CUCICBA 5922   Departamento ubicado en La Porteña 1 edificio del grupo FAENA, frente al hotel, en el corazón de Puerto Madero.  Espectacular 2 amb. de 85 mts con balcon al frente.  Al ingresar a la unidad nos vamos a encontrar con un toilette de recepción.  Cocina integrada, con grandes espacios de guardado y mesadas de mármol de Carrara.  Living comedor de gran tamaño con pisos de madera.  Habitación con baño en suite y vestidor. La misma posee salida al balcon el cual tiene vista hacia el hotel Faena.  1 cochera en el 1er subsuelo.  La Porteña 1 esta en el centro geográfico del barrio mas nuevo de Buenos Aires, y cuenta con 52 residencias distribuidas en 8 pisos.  Desde la entrada misma al edificio, se respira el estilo magnético y sofisticado que Philippe Starck y Alan Faena supieron imprimirle a sus diseños.  Un departamento digno de ser visitado! no dejes de consultarnos.  AMENITIES:  * Sistema de seguridad y control de acceso las 24hs.  * Piscina Climatizada  * Solarium   * Fitness center: gimnasio - sauna  * Laundry La posibilidad de disfrutar los servicios del Hotel mas emblemático.  Obs: ""Para los casos de alquiler de vivienda, el monto máximo de comisión que se le puede requerir a los propietarios será el equivalente al cuatro con quince centésimos por ciento (4,15%) del valor total del respectivo contrato. Se encuentra prohibido cobrar comisiones inmobiliarias y gastos de gestoría de informes a los inquilinos, en el caso de ser personas físicas"".",Alquiler 2amb La Porteña FAENA/ cochera/amoblado,-37.110922,-56.873976,1469,Avenida Arquitecto Jorge Bunge,Buenos Aires,Pinamar,2
e640fa0e421a81383d7bbfa3f0df452e88c7ef45,2017-11-01,rent,Departamento,-27.3901761658,-55.8968912,278.5,40,40.0,2,,"HERMOSO DEPARTAMENTO A ESTRENAR DE 1 DORMITORIODepartamento de un dormitorio, placard y ventilador de techo, cocina con bajo mesada y mesa empotrada en la pared, baño completo con ducha electrica, muy lindo, lugar seguro y tranquilo, sobre importante avenida, muy transitada, servicios urbanos a media cuadra, plazas cercanas y a pasos de la costanera.POSADAS INMOBILIARIA TEL: 4439306 CEL: 3765065456 - 3764733225",ALQUILO DEPARTAMENTO A ESTRENAR DE 1 DORMITORIO($4800 Ref.#231825),-34.71913033333334,-58.25837783333333,441,Almirante Brown,Buenos Aires,Quilmes,2
1feab7d8aa1bd9834b8f93fa4e491d0523c85704,2017-10-26,rent,Departamento,-34.5686317307,-58.4316086228,278.5,17,17.0,1,,MONOAMBIENTE CON KICHINETTE 17 m2 AMOBLADO,MONOAMBIENTE EXCELENTE UBICACIÓN ,-34.3966341,-58.64768577972652,240,Avenida del Puerto,Buenos Aires,Nordelta,2
71dd6b1e0b7e42266e967cf47d21a9a16ac228a7,2017-08-18,rent,Departamento,-34.8879485,-58.3821985,278.5,100,70.0,2,,"Excelente departamento interno, a 150 mt estacin Glew, 1 Dormitorio, Cocina Comedor, Bao, lavadero.Fondo jardin. .Publicado por Lascano Propiedades a traves INMOMAP","SUSPENDIDO Andrade 65, Glew Alte Brown",-34.3966341,-58.64768577972652,240,Avenida del Puerto,Buenos Aires,Nordelta,2
a2782ed34327ac2f2d943c2f4c24d87151335409,2017-10-18,rent,Casa,-37.8765178,-57.5217796,278.5,263,,4,,"Chalet en alquiler por temporada o fracciónequipado 6/8 personasChalet 4 Ambientes. con parque, Sum y cochera ( lote 648 m2., sup. 260m2., cub. 200 m2. – PB.: cochera con baulera (2) – Living Comedor. apaisado con hogar – Toilette - Cocina. separada. con isla – lavadero separado. – sala máquinas – Sum con parrilla – amplio jardín y parque – P.A.: Hall, 3 Dormitorios (1 suitte con hidro y vestidor), todos con amplio balcón terraza – baño tripartimentado – Detalles de calidad, calefacción por losa radiante – Consulte su valor",Chalet en Rumenco,-34.39693,-58.648432,240,Avenida del Puerto,Buenos Aires,Nordelta,2
4c34086d194ddb5029aa1a0816f20b26ff922da3,2017-11-18,rent,Departamento,-34.421189,-58.576327,557.0,40,40.0,2,,"Corredor Responsable: Uno Bienes Raices SRL - CMCPSI 5821Contacto: Lucila Kevorkian - MLS ID # 420041246-130ALQUILER DTO 2 AMBIENTES CONTRAFRENTE CON COCHERA. - IMPECABLE  Y SUPER LUMINOSO !!! Albarellos y Boulevard Saenz Peña, Tigre.  Living Comedor - Cocina integrada - Dormitorio - Baño completo. Balcón con parrilla. Cochera Sup. Cub: 40 mts 2 estimativamente  Se entrega recién pintado  Valor: $10.400.-  mensuales. Expensas: $ 1.500.- estimativamente.  Requisitos: Garantía propietaria de familiar directo de CABA. Constancia de ingresos acordes al monto del alquiler. Ajuste 30% anual.  Informes de la garantía y certificación de firmas a cargo del Inquilino Dos meses de deposito. ",ALQUILER TIGRE - DEPTO 2 amb + COCHERA y PARRILLA,-34.39483,-58.649681,220,Boulevard del Mirador,Buenos Aires,Nordelta,2
17ee6f515005b943cb4a10154920d62934f50452,2017-10-28,rent,Departamento,-34.5920273,-58.3875259,4200.0,180,180.0,5,,"Excelente departamento con o sin muebles , Living doble hacia balcón aterrazado vista al frente, comedor,2 dormitorios con vista abierta hacia contrafrente amplio, 2 baños completos, cocina, dependencia y lavadero. Reciclado.Precio U$S4.200, gastos incluidos.",Departamento en alquiler en recoleta,-34.649869934693875,-58.63995813265306,2259,Montes de Oca,Buenos Aires,Castelar,2
6e942e95cbd8c8ced1c742d31fdd08142a8c5b37,2017-08-12,rent,Departamento,-34.594215,-58.379931,4200.0,290,290.0,5,,"Corredor Responsable: Cristian Arnal Ponti - C.U.C.I.C.B.A 3570Contacto: Liliana Zelerteins - MLS ID # 221046-288PRECIO PAQUETE - USD 4.000 -Importante Torre ,Semipiso de categoría ,muy luminoso al frente sobre la elegante calle Arroyo a metros del Hotel Sofitel.es un  3er piso con 2 cocheras fijas y seguridad las 24 horas.  Amueblado Gran Hall de entrada . Doble entrada :Palier individual y entrada de servicio Gran Living y comedor en ""L""  apaiisajados con ventanales hacia el balcón  aterrazado Escritorio. Toilette  Tv. Plasma en todos los dormitorios y 1 en el living 3 Dormitorios :  1 master en suite con importante. Vestidor. , otro con cama doble , gran placard y el tercero con cama nido (para tres personas ) escritorio y placard , otro baño completo con Jacuzzi  , escritorio muy amplio (o 4to. dormitorio)  con su amplio placard Los baños  con jacuzzi en excelente estado  ..,muy alegres. Amplia cocina con comedor diario, equipada con heladera de doble puerta y freezer no frost, lavavajillas para 12 personas, horno empotrado aparato de cocina 6 hornallas Sector de lavadero con lavarropa y secador de ropa  por calefacción. Dependencia de servicio con baño y muy amplio dormitorio. Agua caliente y calefacción central Aire acondicionado en todos los dormitorios y living/ comedor Persianas eléctricas en todos los ambientes El edificio cuenta con grupo electrógeno PRECIO  TOTALl usd 4.200   PAQUETE !!!!!!!!!  Gran Oportunidad!!!! (Incluye ABL , AYSA , EXPENSAS) Para los casos de alquiler de vivienda el monto maximo de comision que se le puede requerir a los propietarios sera el equivalente de 4,15 centesimos (4,15 %) del valor total del respectivo contrato. Se encuentra prohibido cobrar comisiones inmobiliarias y gastos de gestoria de informes a los inquilinos en el caso de ser personas fisicas.",ALQUILER 5 AMBIENTES  2 COCHERAS  PAQUETE USD 4200,-34.614264,-58.531839,2000,320 - 15 de Agosto,Buenos Aires,Villa Raffo,2
eeb23cbcc8984aa7c79c2d11effa2e13059405e2,2017-07-21,rent,Departamento,-34.610906,-58.36195,4200.0,160,160.0,4,,"Corredor Responsable: Raul Hector Merlo - CUCICBA 2407Contacto: Natalia Faierman - MLS ID # 61079-407Martillero: RAÚL HÉCTOR MERLO CUCICBA 2407 / CSI 5438     Alquiler paquete (incluye Expensas,Abl y Agua) El departamento esta ubicado en el prestigioso edificio Río Plaza , esta totalmente amueblado y equipado con el más exclusivo gusto. Vistas abiertas y panorámicas , muy luminoso. Se puede alquilar mensual , anual o residencial ( por dos años ) Moderno departamento en lujoso edificio de Puerto Madero de 160 metros con 3 dormitorios y dos cocheras y una baulera , para hospedar entre 2 a 6 personas.Ubicado en el barrio más exclusivo ,moderno y seguro de Buenos Aires.Posee 3 dormitorios ,principal en suite ,amplio living y cocina de ultima generación con comedor diario ,baño  completo,toilette y amplio balcón.  .Excelentes amenities  ( piscina, sum,gym etc) Seguridad 24 hs  Cocheras en primer piso super comoda   Se encuentra prohibido cobrar comisiones inmobiliarias y gastos de gestoría de informes a los inquilinos, en el caso de ser personas físicas. Para los casos de alquiler de vivienda, el monto máximo de comisión que se le puede requerir a los propietarios será el equivalente al cuatro con quince centésimos por ciento (4,15%) del valor total del respectivo contrato.",Alquiler amueblado P Madero 3dorm 2 coch Paquete,-34.904989900000004,-57.95622705,425,Calle 4,Buenos Aires,La Plata,2
9ec137cd031199eeca64fb38edb7f19530c4e345,2017-08-09,rent,Departamento,-34.6104263,-58.3617076,4200.0,180,160.0,4,,"Imperdible departamento en Chateau, Puerto Madero. Todo luz y sol. Vista abierta al río. Muy luminoso. El departamento está compuesto por balcón, baulera, cocina, comedor, comedor diario, dependencia de servicio, tres dormitorios en suite, escritorio, hall, lavadero, living comedor, toilette y vestidor. El edificio cuenta con los siguientes amenities: aire acondicionado, calefacción, cancha de deportes, gimnasio, hidromasaje, laundry, piscina, quiencho, sala de juegos, sauna, solarium, SUM y vigilancia. Cochera doble. DIGNO DE VER!!FGK PROPIEDADES./",Julieta Lanteri  - Puerto Madero - Capital Federal,-38.02660163265306,-57.533800693877545,3505,Aristóbulo del Valle,Buenos Aires,Mar del Plata,2
a9b71053179ae16ed75c79d8e4bd8782967ec71d,2017-06-07,rent,Departamento,-34.5778182,-58.4060384,12500.0,595,280.0,4,,"IMPRESIONANTE DEPARTAMENTO EN EL CORAZON DE PALERMO. PISO ALTISIMO. IMPRESIONANTE VISTA A RIO Y A CIUDAD. INCREIBLE DETALLES DE DECORACION, CALIDAD Y EXCELENCIA EN SUS TERMINACIONES. MUY BIEN  DECORADOS, 3 AMPLIAS HABITACIONES EN TRES DE ELLAS SON EN SUITE. AMPLISIMO LIVING COMEDOR CON SALIDA A TERRAZA PROPIA DE 220 MTS CON PARRILLA PROPIA. IMPRESIONANTE MIRADOR!!.LA TORRE SE CARACTERIZA POR SU EXCELENCIA EN AMENITIES- PISCINA CLIMATIZADA SOLARIUM, JUEGO PARA NIÑOS, GIMANSIO, SPA CON JACUZZI, SALA DE RELAX, SALA DE MASAJES SAUNA.SUM, SALON DE NIÑOS- ESTACIONAMIENTO DE CORTESIA, LAUNDRY, COCHERA FIJA Y CUBIERTASEGURIDAD 24 HSVALOR DE ALQUILER U$S 12500 paquete",TORRE GELLY IMPRESIONANTE DEPTO DE 4 AMB MASDEPENDENCIA Y TERRAZA Y PARRILLA PROPIA,-38.008794,-57.537373,1400,Bolívar,Buenos Aires,Mar del Plata,2
7f2d1b22fa7fcec740d95e89c9833a24d181d225,2017-10-20,rent,Departamento,-34.5711496,-58.4232966,5999.0,147,147.0,4,,"Exclusivo departamento en la Torre Bellini 4 AMBIENTES + DEPENDENCIA.Dormitorio Principal en Suite con vestidor y una vista UNICA! 2do Dormitorio con baño completo!  3er Dormitorio! ""Todo el Depto Fue reciclado a Nuevo""Balcón con deck y cerramiento de Vidrio LOCK con posibilidad de abrirlo!  a metros de Av. Libertador, la plaza Alemania, y los parques. Piso altísimo con excelentes vistas al rio, planetario y bosques. Tiene living y comedor, toilette, tres dormitorios (el principal en suite), un baño completo, gran cocina y amplias dependencias de servicio 2. Cochera propia. Edificio con amenities, pileta, gym, microcine, sauna, Parrilleros SUM y demás detalles de categoría. REQUISITOS: Solvencia Locataria, Garantia Propietaria Acorde ala Locación ""demostración de Ingresos"" ""El departamento esta a estrenar Nunca se uso y el Locatario estrenaría todo""",AMOBLADO IDEAL EMPRESA  Torre Bellini Altisimo,-37.987796,-57.578537,5499,Bolívar,Buenos Aires,Mar del Plata,2
