id,created_on,operation,property_type,lat,lon,price_aprox_usd,surface_total_in_m2,surface_covered_in_m2,rooms,expenses,description,title,lat,lon,housenumber,street,state,city,bathrooms
b59b1297b5c4bd6d0c705930e6a92e9c0919eeaf,2017-07-19,rent,Local,-34.5338837,-58.4679703,5500.0,225,190.0,1,,"LOCAL APTO PARA VARIOS DESTINOS.UBICACION ESTRATEGICA.MEDIDAS DEL TERRENO:  8.66mts x 20mtsSUPERFICIE DEL TERRENO: 173M²SUPERFICIE CUBIERTA:  190 M²Sobre un lote con frente de 8,66m sobre la Av Del Libertador, a metros de Gral Paz, se encuentra esta propiedad de 190m² cubiertos, que constan de una planta baja abierta, con vidriera sobre la avenida, baños,  un sector privado que puede oficiar de cocina si se tratara de un emprendimiento gastronómico y un patio. En la planta alta hay dos ambientes cómodos.**Las medidas y superficies expuestas surgen de la información suministrada por el propietario,la empresa no se responsabiliza por la exactitud de las mismas****Coti en trámite**",LOCAL APTO PARA VARIOS DESTINOS. UBICACION ESTRATEGICA.,-27.358370459183675,-55.89987815510205,2496,Moritán,Misiones,Posadas,2
08965bf13abf7c24c75a294ad916f3c0f7d645c1,2017-11-27,rent,Casa,-34.4344123,-58.6310826,5500.0,490,490.0,10,7000.0,"Planta Baja: Gran hall de recepción. Entrada principal con puerta de madera maciza,tallada a mano , diseñada por Fernando Moy. Sistema de apertura con huella digital.Toilette muy amplio,  con mesada de mármolblanco y griferíaHansgrohe línea Stark.Living y comedor de doble altura, todo con vista a la laguna, madera italiana fresno termotratado , tablas anchas y largas  en toda su extensión.  AC Central con control local.Sala de Cine o playroom con proyector y sistema de audio Bose. AC Central con control local.Espacio reservado para bodega con AC independiente.Gran cocina con comedor diario integrado, porcelanatoPortinari, muebles diseñados por Cato Cocinas, mesada de Silestone blanco Zeus, sistema de refrigeración y freezer importado de USA, 1200 litros, fábrica de hielo en bajo mesada, horno empotrado piroliticoSmeg, microondas empotrado, pileta duravit y griferiaHansgrohe.Baño de PB cocina de uso común.Zona de lavadero amplia, con Armarios grandes.Cuarto de servicio con baño.Despensa de gran tamaño, con muebles e iluminación en cada estante.Baulera.Cochera.Planta Alta (5 Cuartos).Master suite con escritorio sectorizado y sala de lectura con biblioteca (en voladizo sobre Living). Escritorio incluye mueble con frigobarintergrado. AC Central con control local.Baño integramente en marmol, grandes ventanales , amplio espacio de guardado, griferia Hansgrohe , bañera Duravit.Dos vestidores separados, totalmente diseñados y equipados.Gran terraza con escalera de acceso al jardín.2 dormitorios en Suite con grandes ventanales y execente iluminación,postigones de madera corredizos y placares. AC Central con control local en cada uno.2 dormitorios sectorizados, son zona de play y baño compartimentado, postigones de madera corredizos, grandes placares.AC Central con control local.Toda la Planta Alta en piso de madera Italiana  fresno termotratado. 3º PisoGimnasio  o gran playroom con acceso a una gran terraza con vistas a Laguna y todo el barrio. Zona con AC independiente de gran capacidad.?EXTERIORGran galería con asador integramente realizado en acero inoxidable, bacha y mesada, incluye conexión de gas.Hermoso parque con riego automatizado.Piscina de hormigón revestida en aquavation blanco, con borde infinito, amplia zona húmeda y luces de led a control remoto. Sistema de filtrado automático.Cisterna de agua independiente para agua potable y para riego y 2 tanques en terraza.Muelle.Baño de piscina con venecitas, mesada de corian y griferia Hansgrohe.EQUIPAMIENTO:Aberturas de PVC , doble vidrio, marca SCHUCO, de vanos amplios y alturas fuera del standard.Aire acondicionado central frio calor , sistema inverter LG de bajo consumo y con equipos individuales en cada ambiente para rápida y fácil regulación de la temperatura en el local.Calefacciónsectorizada por losa radiante en toda la casa, planta alta y baja independientes, caldera Peisa de gran capacidad (70.000 Kcal/h)Sistema de alarma con 8 camaras de seguridad y grabación hasta 30 diasIngreso a la propiedad con huella digital en ambos ingresosGrupo electrógenoautomatizado, alimentado a gas natural e inzonorizado. Arranque automático con corte de energía.Cortinas automatizadas en toda la casa.Ventanas de baños y cocina con persianas embutidas en el doble vidrio.La casa posee doble circulación, con dos escaleras ambas hechas en inglete, la de servicio que permite el acceso desde la cocina hacia los cuartos hecha en porcelanatoingletado, con varandas de acero inoxidable de diseño y luces led embutidas.La escalera principal que permite el acceso desde el living hacia la planta alta , realizada en calacata griega.Iluminación Led en toda la casa.LLÁMANOS Y VENI A CONOCERLA, TE VA A ENCANTAR!Simón SilveyraNegocios Inmobiliarios115-966-3172",Casa - Barbarita,-27.384844,-55.926779,4901,Avenida Chacabuco,Misiones,Posadas,2
ff0c78519274a516b8d8f3eda74bb9d7f37776e0,2017-11-07,rent,Departamento,-34.585162,-58.6032711,5500.0,35,35.0,2,,"DEPARTAMENTO EN ALQUILER PRIMER PISO, COCINA INTEGRADA A LIVING COMEDOR, BAÑO COMPLETO, DORMITORIO CON PLACARD Y BALCÓN.",DEPARTAMENTO EN ALQUILER MARTIN CORONADO,-27.3732358,-55.9400436,3001,Avenida Jauretche,Misiones,Posadas,2
3d54d3c4887a06cd4314483972fe60827f6d7fda,2017-07-19,rent,Departamento,-34.5789897,-58.4014247,11000.0,226,205.0,4,,"Alquilado! Le parc Alcorta. Creo que eso dice todo.Una de las mejores torres de Buenos Aires.Amenities enserio! Parece un hotel!Ubicación super privilegiada y vistas alucinantes. El resto hay que verlo, la calidad, diseño, amplitud, etc.Solicita tu visita con tiempo.Alquiler: U$S 11000 Paquete""Las medidas, superficies y expensas consignadas en la presente son aproximadas; y al solo efecto orientativo. Los datos definitivos son los que surgirán del titulo de la propiedad y de los comprobantes respaldatorios.¨Orwel Proyectos Inmobiliarios153.121.123415",Departamento en Palermo,-32.96374768367347,-60.631946285714285,395,Cerrito,Santa Fe,Rosario,2
2d4fba842197dae3e1c687b83e3f9b9380a69437,2017-09-24,rent,Departamento,-34.5798784,-58.4067029,3650.0,110,110.0,3,,"                TORRE DE PRIMERA CATEGORÍA- PALIER SEMIPRIVADO- AMPLIA RECEPCIÓN APAISADA-TOILETTE- COCINA INDEPENDIENTE- COMEDOR DE DIARIO- LAVADERO SEPARADO- AMPLIA SUITE CON VESTIDOR A MEDIDA- SEGUNDO DORMITORIO EN SUITE CON PLACARDS- 2 AMPLIOS BALCONES CON DECK- CALEFACCIÓN POR LOSA RADIANTE CON TERMOSTATO- AGUA CALIENTE POR CALDERA INDIVIDUAL-  PISOS DE ROBLE AMERICANO ENTABLONADO- ACCESO DE SERVICIO-EXCELENTES VISUALES- UBICACIÓN A PASOS DE AV. DEL LIBERTADOR.-COCHERA FIJA Y BAULERA TIPO CUARTO.-EL PRECIO INCLUYE EXPENSAS Y ABL.AMENITIES: 3 SALONES DE FIESTA- 2 GIMNASIOS- VESTUARIOS- SAUNA- PILETA- SOLARIUM CON DECK- LAUNDRY- COCHERAS DE CORTESÍA- VIGILANCIA Y CONTROL DE ACCESO 24HS.-            Excelencia en Servicios Inmobiliarios, desde 1972.",Departamento - Palermo,-31.4192615298116,-64.15381420838068,977,Carlos Tejedor,Córdoba,Córdoba,2
7b3d6a6680ef7fc8fc4e541dbc7dd2dea4002b5e,2017-10-11,rent,Departamento,-34.5750057,-58.4205517,2500.0,147,137.0,4,,"Hermoso departamento de 4 ambientes con muy buena distribución y luz, sin amoblar. Gran living comedor al frente con balcón y vista a los jardines del Le Parc, tambíen toilette de recepción. Cocina con doble circulación muy cómoda con espacio para comedor diario, tiene lavadero y dependencia. Sala de estar o playroom íntimo que da paso a los tres dormitorios,el principal en suite con grandes placares y vista muy linda al pulmón verde del edificio, el segundo con balcón, la misma vista abierta y placares amplios al igual que el tercero que mira al otro pulmón. Edificio de categoría con seguridad 24 hs. y amenities muy cómodos. Piscina, solarium, SUM, gimnasio y vestuarios con sauna. Incluye una cochera fija y una baulera. Digno de ver!! FGK Propiedades ", Demaria 4500 - Palermo,-34.683989225000005,-58.39968370416667,1073,Enrique Fernández,Buenos Aires,Piñeyro,2
066363d7fcba8bc2e60692065c5d717c889e756d,2017-09-20,rent,Departamento,-34.5523951947,-58.4444539228,2500.0,187,175.0,6,,"Semipiso de categoría todo rodeado de jardines, abierto y luminoso, doble cochera fija, baulera, parrilla, solárium, a 4 cuadras de Av. Libertador, a 4 cuadras de Av. F. Alcorta, Monroe, La Pampa, bosques, Golf. Palier semi privado, Hall de entrada de 2 x 1,10 con placard de recepción, amplio living de 9 x 3,80 y comedor en ""L"" de 6 x 3,40 a balcón aterrazado de 3,50 x 3,50, toilette de recepción, 1º Dormitorio principal en suite c/vestidos de 3,60 x 3,40, 2º y 3º dormitorio de 3,40 x 3,10 ambos c/placard y baño completo, doble circulación, cocina comedor diario dc/excelente equipamiento y alacenas sup. e inf. de 5,50 x 1,60 x 2,20, dependencia y baño de servicio, lavadero y tender cubierto, AA split en todos los ambientes incluida la dependencia, todo vista abierta y luminoso desde todos los ambientes. Excelente estado general, piso tarugado, loza radiante individual, tel. CUCICBA Mat. Nº 419",SEMIPISO A JARDINES-DOBLE COCHERA-PARRILLA-,-38.025006,-57.533926,3399,Leandro N. Alem,Buenos Aires,Mar del Plata,2
446033554bb4c7c223c81cb79798126230b68660,2017-08-20,rent,Departamento,-34.559259,-58.454762,2500.0,146,134.0,4,,"Corredor Responsable: Uno Bienes Raices SRL - CUCICBA 4993 Contacto: María Julia Scopa - MLS ID # 420041201-74Excelente departamento de 4amb , más dependencia de servicio con baño, amoblado. Piso alto, al frente,  con vista abierta a pulmón de manzana, consta de un amplio living comedor en L  con salida a un  balcón de 12m, cocina comedor con doble circulación; toilette de recepción, 3 dormitorios con placard, uno de ellos en suite, lavadero, dependencia de servicio con baño, 2 cocheras fijas cubiertas y baulera. Muy amplio y super luminoso en todos los ambientes. Pisos entablonados de madera en el living y parquet en pasillo y  dormitorios. Persianas de madera en todos los ambientes. Calefacción central por losa radiante y 2 aires frío/calor. Palier privado y entrada de servicio. Muy buena ubicación: a 2 cuadras de Cabildo, a metros del subte D y múltiples líneas de colectivos. Muy buen entorno: embajadas, colegios y centro comercial.  Edificio de Categoría, seguridad!!",Alquiler departamento 4amb Belgrano,-34.8545823,-58.65448,6043,Máximo Herrera,Buenos Aires,Virrey Del Pino,2
327a3763c758f14b04a6b58b68b2ba3e34c3f8c0,2017-09-30,rent,Casa,-34.5570174,-58.4581296,2500.0,220,,6,,"PLANTA BAJA:	             		HALL IMPORTANTE CON HABITACION INTEGRADA PARA RECEPCIONISTA Y                 SALA DE ESPERA CON TECHO VIDRIADO  (PISO MARMOL TRAVERTINO                 NUEVO).		2 HABITACIONES LUMINOSAS A LA CALLE C/PISO PARQUET ROBLE. 		COCINA NUEVA.		BAÑO COMPARTIMENTADO CON ENCIMERA SOBRE MARMOL.		                ESCALERA IMPORTANTE AL 1º PISO.PRIMER PISO:		2 HABITACIONES A LA CALLE  (1 EN SUITE CON TOILETTE CON DUCHA).	        1 TOILETTE RECICLADO.	        BAÑO NUEVO CON VESTUARIO BOX DE DUCHA Y BOX DE INODORO.SEGUNDO PISO:               GRAN SALON EN “L” A LA CALLE DE 8,50 MTS. AL FRENTE (X 6 MTS DE UN LADO Y                4,50 MTS. DEL OTRO LADO).		HABITACION EN ENTREPISO  1,90  X 2,15 MTS.IMPORTANTE: POSEE 9 EQUIPOS FRIO-CALOR SPLIT . También tiene instalación para estufas.GENERALES: 	SUPERFICIE: 205 mts2PETIT HOTEL CLASICO.UBICACIÓN: A DOS CUADRAS DE AVDA. CABILDO Y MONROE.A TRES CUADRAS DEL SUBTE. MUY BUEN ESTADO.BAÑOS: RECICLADOSCOCINA: NUEVA RECICLADA, PISO PORCELANATTO, MUEBLES LAQUEADOS              BLANCO, MESADA GRANITO NEGRO, ETC.) .OPCION DE ASCENSOR A COLOCAR COMBINANDO CON EL PROPIETARIO.HABILITADO por MARTA HARFF (Cosméticos) y por TERAPIAS MEDICAS DOMICILIARIAS S.A. (Clínica del Sueño), Ambos HABILITADOS MUNICIPALMENTEConsultenos para mayor información o programar su visita.Cortese PropiedadesArq. Myriam Cortese (cucicba 221)Charcas 4045 1541498300CORTESE PROPIEDADESCABA , 48328585MYRIAM CORTESE CUCICBA 221AHORA EN ZONA NORTE CON CORTESE PROPIEDADES SRLVANESA ILUNDAIN CMCPSI 61091554189274","Belgrano, casa en alquiler sobre lote propio",-34.51713273469388,-58.57808104081633,1784,206 - Pedro Medrano,Buenos Aires,José León Suárez,2
1e539355518c65ab14b259d257300a68cc380704,2017-10-14,rent,Departamento,-34.5886800856,-58.3875014205,2500.0,130,130.0,4,,"Edificio Dubourg,  excelente reciclado, muy buen gusto, totalmente equipado y amueblado, posibilidad de alquilar una segunda cochera en el edificio. excelente departamento, vigilancia 24 hs.  AYSA incluido en expensasNo apto fumadores. ","Alvear - Callao edificio francés, cochera, gran recepción 2 dormitorios, amueblado, equipado excelente categoría, impecable vigilancia",-34.538237,-58.580669,7302,Diagonal 75 Artigas,Buenos Aires,José León Suárez,2
f540aeff23f4fa141ea75be3ba06ba289e6c4ceb,2017-10-28,rent,Departamento,-34.5903041,-58.3851584,2500.0,162,150.0,4,,"Con increíble ubicación, en edificio de gran categoría. A estrenar!Contrafrente a pulmon abierto, verde y muy luminoso.Palier semiprivado, hall, living, comedor. 2 dormitorios, uno en suite. Cocina, lavadero y dependencia.1 excelente cochera. Vigilancia 24 hs.El precio del alquiler es de U$S2.500 + Gastos.",Departamento en exccelente estado en alquiler en Recoleta,-34.5248299755102,-58.5195436877551,4081,Ricardo Gutiérrez,Buenos Aires,Vicente López,2
0626d3650f5e0575b2705ab6a51457210e1876c0,2017-06-19,rent,Departamento,-34.590767,-58.386934,2500.0,137,130.0,3,,"Montevideo 1800. Excelente piso ,de gran categoría amoblado y equipado.  Hall de distribución, amplio living, escritorio y comedor , con balcón y vista abierta a los jardines del emblemático palacio de la Nunciatura. Dos amplios dormitorios con ventanas llenas de luz, dos baños completos .Gran cocina con muchísimo espacio de guardado. y lavadero con lavarropas y accesorios de planchado. Habitación de servicio con grandes placards y baño de servicio. Totalmente equipado. OPCIÓN ALQUILER TEMPORARIO O 24 MESES CON MUEBLES. PRECIO PAQUETE.""Se encuentra prohibido cobrar comisiones inmobiliarias y gastos de gestoría de informes a los inquilinos que sean personas físicas. Para los casos de alquiler de vivienda, el monto máximo de comisión que se le puede requerir a los propietarios será el equivalente al 4.15 % del valor total del respectivo contrato"". Ley 5859 - Art.5.",Elegante depto amoblado - excelente vista - RECOLETA,-34.54781118367347,-58.55211240816327,2477,114 - Marcelo Torcuato de Alvear,Buenos Aires,Villa Ballester,2
f908a48c9fc507720ba7aa1654697aff622c9b9e,2017-07-19,rent,Departamento,-34.5904771,-58.3849582,2500.0,295,295.0,5,,"EDIFICIO DE CATEGORÍA SOBRE AVENIDA ALVEAR AL FRENTE. SEMIPISO DE CATEGORÍA. 2 COCHERAS. TODO LUZ Y SOL. HALL PRINCIPAL PRIVADO. 4 DORMITORIOS, MAS ESCRITORIO Y DEPENDENCIA CON MUY BUENA DISTRIBUCIÓN. DORMITORIO PRINCIPAL EN EN SUITE CON VESTIDOR. OTROS DOS AMPLIOS DORMITORIOS CON GRAN PLACARD QUE DAN AL CONTRA FRENTE / INTERNO DEL EDIFICIO PARA MAYOR PRIVACIDAD. AMPLIOS ESPACIOS CON MUCHA COMODIDAD CARACTERÍSTICO DE ESTE TIPO DE DEPARTAMENTO DE CATEGORÍA. LIVING CON DIVISIÓN AL ESCRITORIO EL CUAL SE DISPONE AL FRENTE CON SUS VENTANALES AL BALCÓN CORRIDO. TODO PISOS DE MADERA DE ESLABONIA EN EXCELENTE ESTADO. AMPLIA Y COMPLETA COCINA COMEDOR DIARIO. LAVADERO INDIVIDUAL CON SECADOR ORIGINAL EN FUNCIONAMIENTO DEL DEPARTAMENTO MISMO. BAÑOS EN MUY ESTADO. SERVICIOS CENTRALES. AGUA CALIENTE POR CALDERA CENTRAL . CALEFACCIÓN POR LOSA RADIANTE CENTRAL. EL MISMO POSEE DOS Whatsapp: 1127723020 de atención: 10:00hs a 13:00 hs y 14:00 hs a 19:00 hs Atendido por profesionales matriculados. TASAMOS EN EL DÍA.-PATAGONES PropiedadesSan Martin 641 1°piso - Ciudad Buenos AiresWhatsapp: 1127723020",Departamento - Recoleta,-27.36224507755102,-55.88970314693877,1247,3 de Febrero,Misiones,Posadas,2
7395e560ad10c4c7ad9aded25866d80764bb3305,2017-11-17,rent,Departamento,-34.5909452,-58.393014,2500.0,105,98.0,3,,"Alquiler Temporal de Departamento 3 AMBIENTES de Recoleta, Capital FederalCondiciones de ingreso de Alquiler Temporario:Contratos de 6 meses: 1 mes de alquiler, 1 de depósito y 1 de gastos administrativos.Contratos de 5, 4 y 3 meses: 1 mes de alquiler, 1 de depósito (que se devuelve, cuando se finaliza el contrato, al inquilino) y 20% de gastos administrativos.Contratos de 1 y 2 meses: 1 mes de alquiler, 1 de depósito (que se devuelve, cuando se finaliza el contrato, al inquilino) y 25% de gastos administrativos.El valor mensual es paquete e incluye los 7 servicios: expensas, cable, Internet, teléfono, luz, gas, agua y ABL. La luz y el gas siempre con tope de consumo $250 bimestral. El excedente lo paga el inquilino. Nota importante: en los alquileres de 3 o 4 integrantes, la limpieza cada 15 días es obligatoria para el inquilino y queda a su cargo.Las medidas son aproximadas, según los datos proporcionados por el propietario. Consultar por disponibilidad.- Según lo estipulado por el nuevo Código Civil, los contratos serán por 3 meses con renovación -Móvil: Lunes a viernes de 9 hasta 20 hs y sábados de 10 hasta 16 hs+54 9 11  Martillero responsable Horacio A. Rameri Matricula CUCICBA N° 6049",Ayacucho 1600,-31.41926684897959,-64.19022475102041,380,Avenida Marcelo T. de Alvear,Córdoba,Córdoba,2
a839ccd9ee3a1c2ec06644ea26492dfeff15234a,2017-07-19,rent,Departamento,-34.613414,-58.361287,2500.0,62,62.0,1,,Exclusivo departamento en el Hotel Faena Universe (Residencia) esquina IMPERDIBLE !. Amoblado.,Exclusivo departamento Puerto Madero,-34.5833,-58.407,3200,"Pacheco De Melo, Jose Andres",Ciudad de Buenos Aires,Ciudad Autónoma de Buenos Aires,2
172e1b0279531dbbc059fb91d3c95b9a305c72d8,2017-08-10,rent,Departamento,-34.6024961004,-58.3636010524,2500.0,77,69.0,2,,"Alquiler tradicional por 24 meses. AMOBLADO.Alquiler por menor plazo con consultar. precio.Alquiler incluye expensas y ABL: Palier semi privado.77 m2 totales.Living comedor.Ventanales con salida a balcón corrido.Aire acondicionado split F/C.Pisos de madera.Increíble vista al dique.Dormitorio en suite.Ventanales con salida a balcón.Aire acondicionado split F/C.Vestidor. Pisos de madera.Cocina.Con mini comedor diario.Anafe vitrocerámico de cuatro hornallas, horno eléctrico.Muebles de alacena y bajo mesada.Toilette de recepción.Amenities: piscina cubierta climatizada y descubierta con solarium, área de spa (sauna y masajes),salón de fiestas equipado para mas de 100 personas, sala de juegos exclusiva para chicos, fitness center. Seguridad 24 hs. _______________- ALQUILERES TEMPORARIOS: Consultar disponibilidad y condiciones. Indicar tiempo de estadía y cantidad de pasajeros.- VENTAS: La presente oferta de venta está condicionada a la obtención del COTI por parte del propietario (Resol. AFIP 2371).Observaciones: Las superficies y medidas expresadas son aproximadas y se exponen al sólo efecto orientativo, las definitivas surgirán de la escritura y/o planos aprobados de la propiedad. Las Expensas e impuestos son valores aproximados.- Alquileres Tradicionales a 2 años: En el caso de alquileres tradicionales  por contratos de 24 meses: “Para los casos de alquiler de vivienda, el monto máximo de comisión que se le puede requerir a los propietarios será el equivalente al cuatro con quince centésimos por ciento (4,15%) del valor total del respectivo contrato. Se encuentra prohibido cobrar a los inquilinos que sean personas físicas comisiones inmobiliarias y gastos de gestoría de informes”.-",U$S 2500 -  2 amb - Puerto Madero - Juana Manso 400 - Terrazas del Yacht ,-34.5827,-58.4486,6281,Cordoba,Ciudad de Buenos Aires,Ciudad Autónoma de Buenos Aires,2
3044ffcaef81369b4f4578c95054eb78229ca659,2017-07-19,rent,Local,-34.635034824,-58.7755187237,2500.0,500,550.0,3,,"Salón de fiestas a refaccionar en MorenoSobre Colectora entre Faraday y Bouchard con salida a dos callesLote de 63x50x54x55 - 3500 de Sup de terreno - 550m2 de Sup CubSalón, baños y cocinaPosibilidad de 200 mas de tierra al fondo, que es un remanente de vialidad.Oyhanarte Propiedades",Edificio Comercial - Moreno,-34.5586,-58.4476,1963,Montaneses,Ciudad de Buenos Aires,Ciudad Autónoma de Buenos Aires,2
16864caedd8d5dff68d4efea29a5e0d45bb15106,2017-10-10,rent,Casa,-34.4408480891,-58.9368824568,2500.0,380,380.0,6,18000.0,"Casa en Carmel CC, distribuida en una planta, techos de teja y frente cemento.Cuenta con recepción, living con chimenea, comedor (con parrilla), cocina con desayunador, lavadero, dependencia de servicio y baño. Hall de distribución, toilette, escritorio. Tres dormitorios con un baño, suite junior con baño, master suite con vestidor y baño compartimentado.  Playroom/ sala de TV.Afuera: galería con parrilla, jardín con riego y  pileta.Contacto: 111 / Cristián Mieres - C.M.C.P.S.I. Nº 5151",Casa en Carmel,-34.5621,-58.4566,2400,Juramento,Ciudad de Buenos Aires,Ciudad Autónoma de Buenos Aires,2
75bb180a04c15a91d671b192124bad845b30613c,2017-07-13,rent,Casa,-34.447193,-58.545027,2500.0,340,340.0,5,,"Corredor Responsable: Mauro Marvisi - CMCPSI 5574Contacto: Ana Morbello - MLS ID # 420051151-56Martillero :  MAURO MARVISI CSI 5574 / CUCICBA 1762    Todas las propiedades que figuran en mi perfil se encuentran a cargo del profesional matriculado de la oficina, la intermediación y la conclusión de las operaciones serán llevadas exclusivamente por él.     DISPONIBLE A PARTIR DE DICIEMBRE DE 2017 Sólida y muy linda casa en alquiler distribuida en dos plantas. PB: Recepción, Living comedor, Cocina con comedor diario, Toilette, Dependencia con baño y lavadero. PA: Suite con vestidor, dos dormitorios (uno con escalera a un espacio aprovechado como cuarto dormitorio), baño completo y terraza. Exterior: galeria cubierta, jardín, pileta y parrilla. Al fondo hay un cuarto de guardado. Frente con retiro y espacio guardacoche.",ALQUILER DE CASA EN PUNTA CHICA,-34.5827,-58.4486,6281,Cordoba,Ciudad de Buenos Aires,Ciudad Autónoma de Buenos Aires,2
80911a27df54e556445f1fef4a720181a56dbdb8,2017-07-14,rent,Departamento,-34.548489,-58.455441,5000.0,230,230.0,4,,"Corredor Responsable: Ariel Champanier - C.U.C.I.C.B.A. 4330Contacto: Valentin Guerrero - MLS ID # 181204-275Chateau Libertador, piso 37, 3 dormitorios en suite, la suite principal con  hidromasaje y vestidor. Living comedor a un balcón aterrazado con vista abierta increíble a Libertador y el río. 3 baños completos, 1 toilette. Dependencias de servicio, lavadero.  2 Cocheras y baulera. Excelentes amenities como en un hotel 5 estrellas.  Gym, peluquería, salón de fiestas, sum, sala de juegos, jaula de golf, spa, pileta cubierta y descubierta. Para el que quiere vivir bien y con la comodidad que Chateau brinda. Expensas $20.000","Chateau Libertador,4 ambientes en 230 m2,piso 37",-34.5602,-58.4429,1661,Migueletes,Ciudad de Buenos Aires,Ciudad Autónoma de Buenos Aires,2
27eb475b7bd746ba17a7f24033a6b3d093a5ded6,2017-06-16,rent,Departamento,-34.59063,-58.378537,5000.0,256,238.0,4,,"Corredor Responsable: Jorge Salafia - CUCICBA 5666Contacto: Juana Prieto - MLS ID # 420211140-17Lindisimo piso con vista abierta hacia el rio sobre Av. del Libertador entre Suipacha y Esmeralda.  Gran living comedor con salida al balcón corrido al frente. Toilette de recepción. Posee tres dormitorios en suite con jacuzzi. el principal con vestidor. Cocina con comedor diario. Lavadero al final de la cocina con dependencia de servicio. Cortinas en todos los ambientes. Aire acondicionado central. Cochera y baulera. Seguridad 24 horas. Cancha de tenis, picina, gimnasio y plaza de juegos para niños. El edificio cuenta con sistema de alarma contra incendio. Expensas: $18.000 ABL mensual: $4.647. 2 cuotas anuales de $439 por la cochera.",Excelente piso en alquiler sobre Av. Libertador,-34.5854,-58.3965,2600,Guido,Ciudad de Buenos Aires,Ciudad Autónoma de Buenos Aires,2
912882a9371c97bed9fbe3aaa2362b01a1358359,2017-10-25,rent,Departamento,-34.5908137588,-58.3785538283,5000.0,255,237.0,5,18200.0,"Edificio ""Sánchez Elia"", 31 pisos, 4 departamentos por piso.Palier privado.Hall de recepción de 4.00 x 2.50.Living comedor de 10.00 x 8.00 + 5.50 x 6.00.Balcón con vista abierta.Dormitorio principal en suite de 5.50 x 6.00, con piso de madera, vestidor , baño completo con hidro y vista abierta al río.2º Dormitorio en suite de 5.00 x 3.80, con piso de madera, placard, baño completo  y vista abierta.3º Dormitorio de  4.50 x 4.00, con piso de madera, placard y vista abierta.Playroom de 5.00 x 4.00.3º Baño completo.Toilette de recepción.placard de recepción.Cocina de 10.00 x 2.00.Comedor diario de 5.00 x 3.80.Dependencia de servicio.Lavadero independiente.Agua caliente central.Calefacción individual por ductos.Doble circulación.2 Cocheras fijas.Baulera.Edificio con cancha de tenis. Valor venta expresado en dolares.Valor alquiler expresado en dolares.",5 Ambientes,-34.5435,-58.4845,3280,Vedia,Ciudad de Buenos Aires,Ciudad Autónoma de Buenos Aires,2
