id,created_on,operation,property_type,lat,lon,price_aprox_usd,surface_total_in_m2,surface_covered_in_m2,rooms,expenses,description,title,lat.1,lon.1,housenumber,street,city,state,bathrooms
ad8fb77f7333df4dd2b17fd6610a5e69a715f830,2015-12-12,sell,Departamento,-34.6017535,-58.5417082,80000.0,50,44.0,2,,"VENTA DE DEPARTAMENTO EN EDIFICIO A ESTRENAR PISO 4° DPTO ""B"" AL FRENTE. SEMIPISO. 2 AMBIENTES. LIVING. COCINA CON BARRA. HALL DISTRIBUIDOR. DORMITORIO CON FRENTE DE PLACARD. BAÑO CON BAÑERA. BALCON AL FRENTE Y CFRENTE. OPCIONAL COCHERA. LAS MEDIDAS SON APROXIMADAS Y DADAS POR EL PROPIETARIO. CARACTERISTICAS GENERALESEdificio de PB y 7 pisos. Departamentos de 2 ambientes en semipiso  10 unidades.Departamentos de 1 ambiente  6 unidades.Cocheras optativas.Detalles de construcción de categoría y excelentes terminaciones.Aberturas en aluminio línea Módena.Ascensor de puertas automáticas en acero inoxidable.Portero eléctrico con cámara visor.Cámaras de seguridad exterior y hall. Instalación para la colocación de Aire Acondicionado en living y dormitorio.Terminaciones exteriores en revestimiento plástico exterior y piedra.Parrilla  y solárium en terraza.DEPARTAMENTOS DE 2 AMBIENTES EN SEMIPISO PLANTA TIPO 1° A 4° DEPTO ""A y B""  + 5° PISO DEPTO ""A""""Superficie total aprox. 50m2""Balcón vidriado muy amplio y soleado con vista a frente y balcón francés al contra frente en dormitorio. ""Puerta principal enchapada en cedro con insertos de aluminio.""Carpintería metálica en aluminio línea Módena y puertas de interior enchapadas en cedro.""Cocina equipada con artefacto de cocina a gas en acero inoxidable o similar. Mueble bajo mesada, alacena y mueble guarda-termo en melanina con cantos de aluminio y puertas en aluminio y vidrio. Mesada de cocina en mármol a tono con diseño del mueble, bacha en acero inoxidable y grifería mono-comando FV o similar. Termo-tanque  Ecotermo de 73l eléctrico. Pisos en porcellanato pulido, amplia ventana en ambiente.""Living comedor con piso de porcellanato pulido, zócalos de madera y terminaciones en yeso.""Dormitorio con balcón francés, piso de madera tipo flotante de 1era calidad, frente integral de placard de piso a techo, cortina de enrollar y terminaciones en yeso.""Baño completo con cerámicos de 1era calidad de piso a techo, grifería Estalgrif, artefactos Ferrum o similar, receptáculo  de ducha rectangular de apoyar  y mampara. DEPARTAMENTO DE 2 AMBIENTES  5° PISO DEPTO ""B""""Superficie total aprox. 43m2.""Balcón vidriado muy amplio y soleado con vista a frente y balcón francés al contra frente en dormitorio. ""Puerta principal enchapada en cedro con insertos de aluminio.""Carpintería metálica en aluminio línea Módena y puertas de interior enchapadas en cedro.""Cocina equipada con artefacto de cocina a gas en acero inoxidable o similar. Mueble bajo mesada, alacena y mueble guarda-termo en melanina con cantos de aluminio y puertas en aluminio y vidrio. Mesada cocina en mármol a tono con diseño del mueble, bacha en acero inoxidable y grifería mono-comando FV o similar. Termo-tanque  Ecotermo de 73l eléctrico. Pisos en porcellanato pulido, amplia ventana en ambiente.""Living comedor con piso de porcellanato pulido, zócalos de madera y terminaciones en yeso.""Dormitorio con balcón francés, piso de madera tipo flotante de 1era calidad, frente integral de placard de piso a techo, cortina de enrollar y terminaciones en yeso.""Baño completo con cerámicos de 1era calidad de piso a techo, grifería Estalgrif, artefactos Ferrum o similar, receptáculo  de ducha rectangular de apoyar  y mampara. PLANTA TIPO 6° A 7° DEPARTAMENTO ""A"" DE 1 AMBIENTE ""Superficie total aprox. 33m2""Ubicación totalmente al frente.""Balcón vidriado muy amplio y soleado.""Puerta principal enchapada en cedro con insertos de aluminio.""Carpintería metálica en aluminio línea Módena y puertas de interior enchapadas en cedro.""Cocina integrada al ambiente único, equipada con artefacto de cocina a gas en acero inoxidable o similar. Mueble bajo mesada y alacena en melanina con cantos de aluminio y puertas en aluminio y vidrio. Mesada cocina en mármol a tono con diseño del mueble, bacha en acero inoxidable y grifería mono-comando FV o similar. Termo-tanque  Ecotermo de 50l eléctrico. Amplia ventana en ambiente.""Ambiente único en piso porcellanato pulido en combinación con piso de madera tipo flotante de 1era calidad para el área dormitorio. Doble ventanal.""Baño completo con cerámicos de 1era calidad de piso a techo, grifería Estalgrif, artefactos Ferrum o similar, receptáculo rectangular de apoyar y mampara.PLANTA TIPO 6° A 7° DEPARTAMENTO ""B"" DE 1 AMBIENTE ""Superficie total 28m2.""Ubicación contra-frente.""Balcón francés y doble ventana.""Puerta principal enchapada en cedro con insertos de aluminio.""Carpintería metálica en aluminio línea Módena y puertas de interior enchapadas en cedro.""Cocina integrada al ambiente único, equipada con artefacto de cocina a gas en acero inoxidable o similar. Mueble bajo mesada y alacena en melanina con cantos de aluminio y puertas en aluminio y vidrio. Mesada cocina en mármol a tono con diseño del mueble, bacha en acero inoxidable y grifería mono-comando FV o similar. Termo-tanque  Ecotermo de 50l eléctrico. Amplia ventana en ambiente.""Ambiente único en piso porcellanato pulido en combinación con piso de madera tipo flotante de 1era calidad para el área dormitorio. Doble ventanal.""Baño completo con cerámicos de 1era calidad de piso a techo, grifería Estalgrif, artefactos Ferrum o similar, receptáculo en box y accesorios.PLANTA TIPO 6° A 7° DEPARTAMENTO ""C""  DE 2 AMBIENTE CHICO ""Superficie total 38m2.""Balcón vidriado muy amplio y soleado con vista a frente y balcón francés al contra-frente. ""Puerta principal enchapada en cedro con insertos de aluminio.""Carpintería metálica en aluminio línea Módena y puertas de interior enchapadas en cedro.""Cocina integrada al comedor, equipada con artefacto de cocina a gas en acero inoxidable o similar. Mueble bajo mesada, alacena y mueble guarda-termo en melanina con cantos de aluminio y puertas en aluminio y vidrio. Mesada cocina en mármol a tono con diseño del mueble, bacha en acero inoxidable y grifería mono-comando FV o similar. Termo-tanque  Ecotermo de 50l eléctrico. ""Comedor con piso de porcellanato pulido, zócalos de madera y terminaciones en yeso.""Dormitorio con balcón francés, piso de madera tipo flotante de 1era calidad, frente integral de placard de piso a techo, cortina de enrollar y terminaciones en yeso.""Baño completo con cerámicos de 1era calidad de piso a techo, grifería Estalgrif, artefactos Ferrum o similar, receptáculo en box y accesorios. -  - PABLO YARYURA PROPIEDADES",DEPARTAMENTO EN VENTA,-34.60172316530612,-58.54167813061224,3419,434 - Alpatacal,Santos Lugares,Buenos Aires,2
8d825e64222e17f3637d91005c56f0d782994d3e,2016-05-22,sell,Departamento,-34.5938959,-58.547855,80000.0,74,41.0,3,,"VENTA DE DEPARTAMENTO EN EDIFICIO PISO 4° DPTO ""A"" AL FRENTE POR ESCALERA. 3 AMBIENTES. ENTRADA PPAL Y DE SERVICIO. LIVING CON PISOS CERAMICOS. COCINA CON MUEBLES ALTOS Y BAJOS Y CERAMICOS. HALL DISTRIBUIDOR CON CERAMICOS. BAÑO CON BAÑERA Y CERAMICOS. DOS DORMITORIOS CON PLACARDS Y ALFOMBRADOS. LAVADERO EN PATIO. BALCON CORRIDO AL FRENTE CON CERAMICOS. PATIO AL FONDO DESCUBIERTO CON CERAMICOS (4.00 X 9..00). TERRAZA ACCESIBLE EN COMUN. A METROS DE EST LOURDES DEL FF URQUIZA. POSIBILIDAD DE ALQUILAR COCHERA EN EL EDIFICIO. ESTADO ORIGINAL MUY BUENO. LAS MEDIDAS SON APROXIMADAS Y DADAS POR EL PROPIETARIO. EL VALOR DE LAS EXPENSAS ES ESTIMATIVO Y PUEDE SUFRIR MODIFICACIONES SIN PREVIO AVISO. -  - PABLO YARYURA PROPIEDADES",DEPARTAMENTO EN VENTA,-34.5938436,-58.54780195714285,4079,432 - Doctor Atilio Carbone,Santos Lugares,Buenos Aires,2
72fd3b8cd1f471269c6863435c8b87b970afb43f,2016-05-21,sell,PH,-34.5735246862,-58.5202907019,80000.0,85,70.0,2,,"VENTA DE TIPO CASA 2 AMBIENTES AMPLIOS CON PATIO EN VILLA MAIPU.TIPO CASA AL FRENTE EN PLANTA BAJA, CONSTA DE COCINA COMEDOR AMPLIA CON MUEBLES BAJOS, LIVING  CON PISOS EN CERÁMICO, BAÑO COMPLETO, 1 DORMITORIO AMPLIO CON PISOS EN CERÁMICO, AMPLIO PATIO, LAVADERO INDEPENDIENTE, TERRAZA ACCESIBLE.  MUY BUEN ESTADO GENERAL.MUY BUENA UBICACIÓN, PROXIMIDAD A CONSTITUYENTES , AVENIDA SAN MARTÍN Y GENERAL PAZ.CONSULTE.PARA MAS INFORMACIÓN COMUNÍQUESE CON NOSOTROS AL 47687646 / 47224198 DE LUN A VIE DE 9.30 A 12.30 HS / 15.30 A 19.30HS Y SAB. DE 9.30 A 13HS O INGRESE EN NUESTRA WEB:  TAMBIEN PODES ENCONTRARNOS EN: , TWITTER/, GOOGLE + Y LINKEDIN. -  - ROCCHIO PROPIEDADES",PH EN VENTA,-34.57350973469387,-58.52026879591837,1309,51 - Santa Marta,Villa Maipú,Buenos Aires,2
8e048aeadee7f761569190268fe03ee9eef499ac,2016-05-02,sell,Casa,-34.5495860045,-58.5675945816,80000.0,0,120.0,3,,"Casa 3 ambientes sobre lote de 7,50 x 29 mts A REFACCIONAR! Hall de ingreso, 2 Dormitorios (amplios), Living Comedor, Cocina Comedor, Baño, Patio (con acceso directo desde la calle), Cuarto de herramientas 3,5 x 6, Fondo Libre y Terraza. 442",Casa 3 ambientes con gran fondo libre a refaccionar en Villa Ballester,-34.549520349999995,-58.567547275,5581,81 Bolivar,Villa Ballester,Buenos Aires,2
4802b6b02d7903983ff0e8ad4a38bf53bf1054a1,2016-03-09,sell,Departamento,-31.4256,-64.1879426,96400.0,52,49.0,2,,"            Departamento de 1 dormitorio. Excelentes detalles de terminación. Ubicación en zona residencial de Nueva Córdoba, un barrio joven y  pujante en infraestructura y nuevos emprendimientos.  Posesión inmediata.cocina separada,living comedor, 1 baño con bañeraBalcón que mira a calle Derqui.Actualmente AlquiladoAviso: Sujeto a disponibilidad ""La información contenida en este mensaje es meramente referencial. Los datos incorporados en el mismo no constituyen oferta alguna,la cual se encuentra sujeta a la confirmacion del propietario, por lo que sus términos no resultarán vinculantes debiendo los interesados concurrir a las direcciones especificadas en el presente a los efectos de procurarse toda información que pudiera resultar de relevancia a los efectos de la adquisición de una unidad.""Aviso: Sujeto a disponibilidad ""La información contenida en este mensaje es meramente referencial. Los datos incorporados en el mismo no constituyen oferta alguna,la cual se encuentra sujeta a la confirmacion del propietario, por lo que sus términos no resultarán vinculantes debiendo los interesados concurrir a las direcciones especificadas en el presente a los efectos de procurarse toda información que pudiera resultar de relevancia a los efectos de la adquisición de una unidad.""",Departamento 1 dormitorio en Nueva Córdoba,-31.425615,-64.187888,2,Derqui,Córdoba,Córdoba,2
f0a4b6e3157988f396f2a9a19a27162b6b0439d9,2016-04-22,sell,Departamento,-38.0090155,-57.5504021,152000.0,80,80.0,3,,EDIFICIO EN POZO ENTREGA DICIEMBRE 2017SEMIPISOS DE 80 MTS A LA CALLE CON BALCON CUBIERTOCOCHERA OPCINAL 20 MIL DLS CUB 15 MIL DLS DESCUBIERTADETALLES DE CATEGORIA TOMA PROPIEDAD O VEHICULO O FINANCIA,Departamento en Venta. Ambientes. Dormitorios. 80 m2. 80 m2c,-38.009159,-57.55035,2300,Rawson,Mar del Plata,Buenos Aires,2
9c71cee74b27f2a37ccecb9c8b2acc2cbd216457,2016-04-08,sell,Departamento,-34.5298291,-58.503246,152000.0,69,62.0,3,,"EXCELENTE DPTO 3 AMB, SEMI NUEVO, EN DUPLEX, CON PATIO. TOTAL 69M2, CON COCHERA FIJA CUBIERTA Y BAULERA. PROXIMO A PANAMERICANA Y COLEGIO LASALLE.  BAÑO COMPLETO Y TOILETTE//.""LOS DATOS, MEDIDAS Y ANTIGUEDAD SON ESTIMADOS Y SUMINISTRADOS POR EL DUEÑO"" Código de propiedad: DAP207488Horacio Igarzabal CMCPSI Mat Nº 3154 DIC PROPIEDADES S.A. - ",Departamento en Florida Mitre/Este,-34.52989006122449,-58.5032121632653,2962,Presidente Hipólito Yrigoyen,Vicente López,Buenos Aires,2
14c9452d85f96edd66b6fe53c86f5bb9b8174680,2016-05-05,sell,Casa,-34.7380176,-58.3782109,152000.0,0,130.0,3,,Casa 3 ambientes con Jardín al frente. Entrada de auto cubierta(3.00 x 8.00). Doble entrada. Cocina-Comedor con muebles alto y bajo mesada ( 8.00x3.50). Living con piso cerámico (3.50x3.80). Hall Distribuidor (2.00x1.00). 2 Amplios Dormitorios (1 con piso de parquet (3.00x4.00) 1 alfombrado (3.00x6.00)). Patio (6.00x4.00). Cocina con lavadero y horno de pizza (5.00x4.00). Baño auxiliar con ducha (2.00x1.00). Fondo Libre con parrilla (12.00x8.00) y Cuarto de enseres (2.00x3.00). ,Acevedo al 3500,-34.73795100612245,-58.37817171428571,3538,Manuel Antonio de Acevedo,Banfield,Buenos Aires,2
287da01dbfedac615a4962766fa6c28c1bf94947,2016-02-28,sell,Departamento,-34.523754,-58.7373285,38000.0,43,43.0,2,640.0,"Muy buen departamento sobre Av. Pres. Perón a 10 cuadras de 197 y a 13 de la estación de José C. Paz.El departamento esta ubicado en 1° piso, se ingresa al living comedor, hacia la izquierda se ubica el baño y la habitación con placard y hacia la derecha la cocina con el lavadero independiente, posee un amplio balcón y excelente luminosidad. Los pisos son de granito.Si bien el edificio es antiguo el departamento se encuentra muy bien mantenido.ROILANDS REAL ESTATE NETWORKAv. Libertador 6810 4to. A, CABA, Tel.  Corredor responsable: Mariano Mussi C.U.C.I.C.B.A Nro. 4065Av. Libertador San Martín 23, Los Cardales, Tel. Corredor responsable: Fabian Jose Muss C.M.Z.C Nro. 217 T.1 F.73",VENTA DEPARTAMENTO 2 AMBIENTES EN JOSE C PAZ,-34.524032,-58.736723,4048,Avenida Presidente J.D. Perón,San Miguel,Buenos Aires,2
69da212c3d9da780fb8c291098a8313a2abce7e9,2016-03-12,sell,Departamento,-36.7105585,-56.6763211,38000.0,35,,2,,"DEPARTAMENTO A UNA CUADRA DEL MAR, EQUIPADO PARA 3 PERSONAS GANAS NATURAL AGUA DE RED , A LA VUELTA DEL MUELLE DE MAR DE AJO EXCELENTE ZONA DE DESCANSO.2 PISO X ESCALERA.",DEPTO 1 CUADRA DEL MAR,-36.71055470408163,-56.676237475510206,833,Newbery,San Bernardo del Tuyú,Buenos Aires,2
85c9fa094fc029ad550fbe82881d1a2c3562e313,2016-04-14,sell,Departamento,-38.0032556,-57.550614,38000.0,25,25.0,1,,DEPTO MONO AMBIENTE A LA CALLE CON BALCÓN SALIENTE EN MUY BUEN ESTADO. COLON ENTRE SAN LUIS Y CÓRDOBA. VEREDA DE SOL. OPCIÓN QUE SE VENDA CON MUY BUENA RENTA Y UNA CHICA SOLA MUY PAGADORA. EL VALOR ES DE U$S 38.000.-  AMOBLADO,Departamento en Venta. Ambiente. Dormitorio. 25 m2. 25 m2c,-38.00319685714286,-57.550586918367344,2639,Avenida Colón,Mar del Plata,Buenos Aires,2
a260df3e712d0382dab9ea8aeba61780e4b09963,2015-11-26,sell,Departamento,-37.99271,-57.5803989,38000.0,45,45.0,2,,"Departamento tipor PH a la venta, en planta alta. Al contra frente. Living comedor con cocina integrada, baño completo, dormitorio con piso parquete y placarad. Patio.ACEPTA PERMUTA MAYOR VALOR, COMO DUPLEX, PH, DE 3 AMBIENTES CON COCHERA Y PATIO Y/O JARDIN.- CONSULTE!!!!",Departamento 2 ambientes en venta SIN EXPENSAS,-37.99262679591837,-57.58035008163266,5339,Alberti,Mar del Plata,Buenos Aires,2
8bbb744fc328fad6e9d8961297aa626b1e201eae,2016-04-14,sell,Departamento,-38.0104452,-57.5431155,38000.0,25,25.0,1,,"OPORTUNIDAD!!!1 ambiente contrafrente , compuesto por:Cocina con revestimientos en ceramico y termotanque electricoBaño revestido en ceramico ambiente con ventanal y pisos de ceramico",OPORTUNIDAD!!! VENDO 1 AMBIENTE AL CONTRAFRENTE EN LAS HERAS 2500. Ambiente. Dormitorio. 25 m2. 25 m2c,-38.010428,-57.542933,1699,Gascón,Mar del Plata,Buenos Aires,2
e7c145cf040d9114163471d61b970d4eb69d4d7a,2016-01-05,sell,Departamento,-38.010878,-57.5435079,38000.0,24,24.0,1,,"Un ambiente contrafrente abierto  amplia vista en un 6º piso compuesto de Cocina, amplio living comedor divisible del dormitorio , baño.-Idel inversion para renta , a metros del nuevo centro cultural ex terminal, a pocas cuadras del mar, centro comercial guemes.-Estado original, con obra de gas terminada",1 AMBIENTE- EX TERMINAL,-38.01080240816327,-57.54360695918368,2555,Las Heras,Mar del Plata,Buenos Aires,2
a39f922f9fc1e937c924330532211f887fb7e3ee,2016-05-06,sell,PH,-34.587078,-58.5366665,38000.0,33,28.0,2,,"PH PB interno de 2 ambientes con Patio compartido Cocina 2 x 1, Comedor 3 x 3, Dormitorio 3 x 3, Baño c/Ducha y Patio compartido 4 5 x 3 5 c/Baulera162",PH 2 ambientes con patio compartido en Villa Lynch,-34.586997326530614,-58.53673546938776,4539,36 - Cantón,Villa Lynch,Buenos Aires,2
8c9e91ab2de7c77b721d1f57bc7433d4d52724a2,2016-04-13,sell,Departamento,-34.604037,-58.410365,76000.0,39,35.0,1,,"1 AMB.- NUEVO - MUY AMPLIO - AL FRENTE - SUPER LUMINOSO - APTO PROFESIONAL - BAÑO PARA DISCAPACITADO - FRENTE SHOPPING - A 1 CUADRA DEL SUBTE ""B"" y AV. CORRIENTES.- AMENITIES: LAUNDRY.CON ACCESO PARA DISCAPACITADO.","APTO PROFESIONAL - 1 AMB - AL FRENTE - 1 CUADRA DEL SUBTE ""B""",-34.604145,-58.410257,3200,Avenida Corrientes,Ciudad Autónoma de Buenos Aires,Ciudad de Buenos Aires,2
17c7ebb25328ec8954ba1228de6231634a60483b,2016-01-09,sell,PH,-34.6672419,-58.7203047,76000.0,62,60.0,3,1.0,"Si te intereso esta propiedad contactate ahora mismo sin compromiso desde el formulario de contacto, o llamanos y consulta por el inmueble código: EPH177990Podemos encontrar la propiedad que estas buscando y enviártela por mail para que no la pierdas. Contactate ahora, te llamaremos y juntos lograremos el objetivo!",Duplex 3 ambientes sobre av. Argentina,-34.667281548979595,-58.720223242857145,680,Avenida Argentina,Merlo,Buenos Aires,2
440711b324cde4ecef8dc5de7078b53ea8b7a22a,2016-04-04,sell,PH,-34.4988588,-58.5550284,76000.0,45,45.0,3,,"Ph al frente en planta baja con un dormitorio y escritorio o 2 dormitorios. Living comedor al frente. baño, cocina con amoblamientos completos. jardín común al fondo que es utilizado también como espacio guardacoches. Un espacio del jardín fue cercado para uso propio de común acuerdo con vecinos pero no es espacio propio.  Apto vivienda y profesional/comercial (peluqueria, tienda,etc)/ PROPIEDAD APTA CREDITO ""Los datos, medidas y antigüedades son estimativas y suministrados por el propietario""Código de propiedad: DPH205614Horacio Igarzabal CMCPSI Mat Nº 3154 DIC PROPIEDADES S.A. - ",PH en Boulogne,-34.498862524489795,-58.55501670204082,87,Pichincha,Villa Adelina,Buenos Aires,2
d58f40b009bb3b4bcced830426b6cee810b7b715,2016-04-19,sell,Departamento,-38.0138494,-57.5487269,76000.0,62,83.0,3,,"DEPARTAMENTO 3 ambientes , 2 patios  , de epoca , IDEAL PROFESIONALES - LATERAL En barrio Chauvin , en calle Arenales   y Alvarado ,  a pocas cuadras de Centro Cultural y Comercial Vieja Terminal .Zona muy buscada , por la seguridad  y por ser Residencial .Se ofrece departamento de 83 m2 totales , y 62 m2 cubiertos .",DEPARTAMENTO 3 amb .- 2 patios ,-38.013769571428575,-57.54881916326531,3061,Arenales,Mar del Plata,Buenos Aires,2
942445ce8d2b42442c462251f04e4a8c9a982d32,2016-04-27,sell,Departamento,-38.0087338,-57.5443846,76000.0,43,40.0,2,,"A solo 2 cuadras de Plaza Colón y con orientación a la calle, le presentamos el siguiente departamento de 2 ambientes totalmente externo y con muy buen mantenimiento. Posee cocina separada con amoblamientos nuevos a medida  El living comedor es al frente sobre calle Arenales, con balcón saliente. Dormitorio separado con placard empotrado. Baño completo con bañera. Muy buen edificio con excelente mantenimiento!!Para ver videos, planos y más información visite:  Propiedades.Lamadrid 2275.(0223) 494-3954",2 Ambientes a la calle a 200mts de Plaza Colon. Ambientes. Dormitorio. 43 m2. 40 m2c,-38.00879,-57.544418,1900,Falucho,Mar del Plata,Buenos Aires,2
b737ba1fe2e61429f570e6ac7a8f91c0f9161f53,2015-12-22,sell,Departamento,-34.6027207595,-58.5601051172,76000.0,42,40.0,2,1000.0,"Venta de Departamento 2 AMBIENTES en Caseros.cercano a estación caseros, living - comedor, cocina semi integrada con desayunador,lavadero incorporado, dormitorio con placard, balcon. -  - COZZO PROPIEDADES",DEPARTAMENTO EN VENTA,-34.602715,-58.56007557142857,2230,519 - Federico Rauch,Caseros,Buenos Aires,2
3ef5abdc5d6bafebc840eca8f4b97d1f174ebee6,2016-02-23,sell,Departamento,-34.6027207595,-58.5601051172,76000.0,42,40.0,2,,"Venta de Departamento 2 AMBIENTES en Caseros.cercano a estación caseros, living - comedor, cocina semi integrada con desayunador, bajo mesada, alacenas aéreas, despensa, lavadero incorporado, dormitorio con placard y balcón. Edificio con parrillas y solarium. -  - COZZO PROPIEDADES",DEPARTAMENTO EN VENTA,-34.602715,-58.56007557142857,2230,519 - Federico Rauch,Caseros,Buenos Aires,2
fa4986114e0c7880f5d3220dcd3024514ed6caef,2016-05-11,sell,Departamento,-31.4102247,-64.1938317,144000.0,0,102.0,6,1675.0," DUPLEX EN BARRIO CENTRO, UBICADO EN LA CALLE URQUIZA AL 200 A MTS DE AVENIDA COLON. EDIFICIO CUENTA CON TERRAZA DE USO COMPARTIDO, QUINCHO Y ASADORES. DISPOSICIÓN EXTERNA,  NO BALCÓN PERO HAY GRAN LUMINOSIDAD. CUENTA CON:  PLANTA ALTA: COCINA CON MUEBLE BAJO MESADA, ALACENAS Y TERMOTANQUE, COMEDOR. LAVADERO. LIVING, BAÑO. 1 DORMITORIO CON PLACARD.PLANTA BAJA: 2 DORMITORIOS UNO DE ELLOS CON PLACARD, BAÑO, DORMITORIO DE SERVICIO CON BAÑO PRIVADO. TIENE 2 CALEFACTORES, AIRE ACONDICIONADO. INMOBILIARIA ESTEBAN.","DUPLEX 3 DORMITORIOS, CENTRO. IMPERDIBLE.",-31.41020038163265,-64.19389503265306,207,General Justo José de Urquiza,Córdoba,Córdoba,2
1f9ea1dfd2411389c94a4807193e09e5df46ceb2,2016-05-03,sell,Departamento,-34.5447730762,-58.4751792554,144000.0,120,80.0,3,,"VENTA DEPARTAMENTO 3 AMBIENTES EN SAAVEDRADepartamento tipo ""PH"" sin expensas.En planta baja: Living comedor. Cocina. Baño completo. Dormitorio. Planta alta: Un dormitorio. Cuarto de herramientas y parrilla.Espacio aéreo propio con posibilidad de ampliar .Superficie total 120m2.Para más información contáctenos: Sucursal Núñez: Sucursal Olivos: Sucursal Villa Adelina: Sucursal Carapachay: Sucursal Florida: ",Departamento en Saavedra,-34.5448,-58.4752,4305,Vidal,Ciudad Autónoma de Buenos Aires,Ciudad de Buenos Aires,2
144c770b994660fa8646f569a6f07da8374e0d30,2016-05-03,sell,Departamento,-34.500693,-58.4974466,144000.0,64,64.0,3,500.0,VENTA DEPARTAMENTO 3 AMBIENTES EN OLIVOSExcelente departamento de 3 ambientes en Olivos ubicado a metros de Avenida Maipu y centro comercial. El mismo se desarrolla de la siguiente forma: living comedor. Cocina. Baño completo. 2 dormitorios. Vestidor. Lavadero independiente. Alarma. Espacio guarda coche. Parrilla de uso común. Excelente luminosidad. Propiedad apto profesional. Venta no condicionada a reubicación. Para más información contáctenos: Sucursal Núñez: Sucursal Olivos: Sucursal Villa Adelina: Sucursal Carapachay: Sucursal Florida: ,Departamento en Olivos,-34.50073918181818,-58.4974239050505,1544,Manuel Díaz Vélez,Vicente López,Buenos Aires,2
26e61f2d904ae09fd1d2ca60a13460ecf773899f,2016-03-29,sell,Casa,-34.5225494,-58.5097122,288000.0,153,153.0,4,,"Venta de Casa 4 AMBIENTES en OlivosMuy buen chalet de 4 ambientes en 1 plata sobre un lote de 12 x 33,66 con 153 mts cubiertos. Amplio living comedor, toilete de recepción, cocina comedor diario, 3 cómodos dormitorios con placards e interiores y baño completo. Amplio garage para un auto y cochera afuero para otro auto. Gran jardín al fondo. Digna de visitar...PASTORI TEL.  -  -  - CMCPSI 5646 - CUCICBA 6238 - -  - PASTORI PROPIEDADES",CASA EN VENTA,-34.52251307142857,-58.5096649,2557,Coronel Manuel Rosetti,Vicente López,Buenos Aires,2
86ef902b7c7cfc4de7657c4416312bc1765310a0,2016-02-25,sell,Departamento,-38.0074243681,-57.5434419413,36000.0,18,18.0,1,,"Oportunidad! 1 Ambiente a metros de Plaza Colon!!!Departamento de un ambiente único, cocina separada, baño con ducha. Primer Piso interno.$ 36.000.-Ficha 5189Departamento de un ambiente único.Interno en un primer piso.Edificio a 50 metros de la Plaza Colon, ubicacion inmejorable!18 metros cuadrados.Pisos de parquet.Placard empotrado a la pared.Ubicación. Arenales entre Colon y almirante Brown.",1 Ambiente unico Plaza Colon,-38.0074731632653,-57.543386653061226,2242,Arenales,Mar del Plata,Buenos Aires,2
da97ad451d2b79a1d8d2fde9e9c4d1cf6ba8f913,2015-11-06,sell,Departamento,-32.9387063,-60.6405847,72000.0,38,33.0,1,,ESPECTACULAR MONOAMBIENTE. CALIDAD. VISTA PARCIAL RÍO. EXCELENTE UBICACIÓN. AMPLIO BALCÓN. PLACARD. COCINA CON BARRA. ANTE BAÑO Y BAÑO CON BAÑERA. EXPENSAS 600$ APROX. CALDERA INDIVIDUAL (AGUA CALIENTE Y CALEFACCÓN). ABERTURAS DOBLE VIDRIO HERMÉTICO.ESPECTACULAR MONOAMBIENTE. CALIDAD. EXCELENTE UBICACIÓN. VISTA PARCIAL RÍO. AMPLIO BALCÓN. PLACARD. COCINA CON BARRA. ANTE BAÑO Y BAÑO CON BAÑERA. EXPENSAS 600$ APROX. CALDERA INDIVIDUAL (AGUA CALIENTE Y CALEFACCIÓN). ABERTURAS DOBLE VIDRIO HERMÉTICO.,MONOAMBIENTES SALTA 14OO. EXCELENTES.,-32.9387946,-60.6405485,201,Corrientes,Rosario,Santa Fe,2
eb2e3249d53708f69ec9bfdc9f11cca630953276,2016-03-11,sell,Departamento,-34.6173396,-58.4493817,72000.0,33,30.0,1,800.0,"NORBAIRES PROPIEDADESCaballito Aranguren 1200AMBIENTES LUMINOSOS CON BALCÓN.APTOS CRÉDITOS POSESIÓN INMEDIATACaballito departamentos Monoambientes desde 30 m2, a estrenar con entrega inmediata. Departamentos con baño completo y cocina incorporada (artefacto a gas), mueble bajo mesada con estante tipo alacena, termotanque eléctrico, carga y descarga para el lavarropas, piso flotante. Pensados para tener excelente iluminación y ventilación, los hay con balcón o terraza propia. Terraza de uso común con parrilla, solárium y laundry. Orientación noreste. Edificio moderno de 7 pisos amplio hall de entrada con ascensor. Opcional cocheras cubiertas en planta baja y primer piso. Apto Profesional. Ubicación: Aranguren al 1200. Muy buenos accesos y variedad en medios de transporte, a 4 cuadras de la estación de tren Caballito y a 5 de la estación de subte Primera Junta de la línea A. INMOBILIARIA NORBAIRES",Departamentos venta,-34.6173,-58.4495,1205,"Aranguren, Juan F., Dr.",Ciudad Autónoma de Buenos Aires,Ciudad de Buenos Aires,2
